{"$schema":"http://json-schema.org/draft-07/schema#","$id":"https://agentic-website-studio.local/schemas/m43-human-expansion-approval.schema.json","type":"object","required":["schemaVersion","approvalId","action","humanDecision","approvedImplementation","scope","provenance"],"properties":{"schemaVersion":{"const":"1.0.0"},"approvalId":{"const":"approval_wayfinder_m43_expansion_01"},"projectId":{"type":"string"},"selectedConceptId":{"type":"string"},"action":{"const":"approve_for_expansion"},"humanDecision":{"type":"object"},"approvedImplementation":{"type":"object"},"scope":{"type":"object"},"provenance":{"type":"object"}}}
